{
  "contact_name": "Example Researcher",
  "contact_email": "researcher@example.edu",
  "institution_name": "Example University",
  "lab_name": "Example Neuroimaging Lab",
  "participation_commitment": true,
  "data_use_agreement": true,
  "accepted_data_use_policy_version": "archive-access-1.0.0"
}
